<?xml version="1.0" encoding="UTF-8"?>
<!DOCTYPE shop SYSTEM "file:/C:/Users/user/Desktop/xml/shop.dtd">
<shop><supplements><supplement id="HR01021324" type="P" purpose="P21"><name>Ð¨Ð¾Ðº</name><price>83</price><rating>5</rating><image>shock.jpg</image><quantity>1</quantity><taste>ÑˆÐ¾ÐºÐ¾Ð»Ð°Ð´</taste><content><material><material_name>Ð¿Ñ€Ð¾Ñ‚ÐµÐ¸Ð½</material_name><value>100</value><unit>Ð³</unit></material></content><description>ÐÐºÐ¾ Ð¸ÑÐºÐ°Ñ‚Ðµ Ð´Ð° ÑÑ‚Ðµ Ð·Ð°Ñ€ÐµÐ´ÐµÐ½Ð¸ Ð¸ Ð¼Ð¾Ñ‚Ð¸Ð²Ð¸Ñ€Ð°Ð½Ð¸ Ð²ÑŠÐ² Ñ„Ð¸Ñ‚Ð½ÐµÑÐ°, Ð¨Ð¾Ðº Ðµ Ñ‚Ð¾Ñ‡Ð½Ð¾ Ð·Ð° Ð²Ð°Ñ. Ð¢Ð°Ð·Ð¸ Ñ„Ð¾Ñ€Ð¼ÑƒÐ»Ð° Ñ‰Ðµ ÑÑ€Ð°Ð±Ð¾Ñ‚Ð¸ Ð¿Ñ€Ð¸ Ð½ÑÐºÐ¾Ð¸ Ð¼Ð½Ð¾Ð³Ð¾ Ð¸Ð½Ñ‚ÐµÐ½Ð·Ð¸Ð²Ð½Ð¸ Ñ‚Ñ€ÐµÐ½Ð¸Ñ€Ð¾Ð²ÐºÐ¸ Ð¸ Ñ‰Ðµ Ð²Ð¸ Ð¿Ð¾Ð¼Ð¾Ð³Ð½Ðµ Ð´Ð° Ð½Ð°Ñ‚Ñ€ÑƒÐ¿Ð°Ñ‚Ðµ Ð¼Ð°ÑÐ°. Ð¢ÑÐ»Ð¾Ñ‚Ð¾ Ð²Ð¸ Ñ‰Ðµ ÑÐµ Ñ‡ÑƒÐ²ÑÑ‚Ð²Ð° Ð·Ð°Ñ€ÐµÐ´ÐµÐ½Ð¾ Ð¿Ñ€ÐµÐ· Ñ†ÐµÐ»Ð¸Ñ Ð´ÐµÐ½ Ð¾Ñ‚ ÐºÑ€ÑŠÐ²Ñ‚Ð°, Ð²Ñ€ÑŠÑ…Ð»Ð¸Ñ‚Ð°Ñ‰Ð° Ð¼ÑƒÑÐºÑƒÐ»Ð½Ð°Ñ‚Ð° Ð²Ð¸ Ñ‚ÑŠÐºÐ°Ð½ Ð¸ Ð´Ð¾ÑÑ‚Ð°Ð²ÑÐ¹ÐºÐ¸ Ð½ÑƒÑ‚Ñ€Ð¸ÐµÐ½Ñ‚Ð¸Ñ‚Ðµ, Ð½ÐµÐ¾Ð±Ñ…Ð¾Ð´Ð¸Ð¼Ð¸ Ð·Ð° Ð¸ÑÑ‚Ð¸Ð½ÑÐºÐ¸ Ñ€Ð°ÑÑ‚ÐµÐ¶.</description><brand>Ð£Ð½Ð¸Ð²ÐµÑ€ÑÐ°Ð»</brand><packings packing_types_id="P01"><packing>2.225</packing><measurement_unit>ÐºÐ³</measurement_unit><servings>22 Ð´Ð¾Ð·Ð¸</servings></packings></supplement></supplements><types><type type_id="P">ÐŸÑ€Ð¾Ñ‚ÐµÐ¸Ð½Ð¸</type></types><purposes><purpose international_code="P21">Ð˜Ð·Ð³Ñ€Ð°Ð¶Ð´Ð°Ð½Ðµ Ð½Ð° Ñ‡Ð¸ÑÑ‚Ð¸ Ð¼ÑƒÑÐºÑƒÐ»Ð¸</purpose></purposes><packings_types><packing_types pid="P01">Ð¿Ñ€Ð°Ñ…</packing_types></packings_types></shop>
